<?xml version="1.0" ?>
<!ELEMENT Books (bookname, author1, author2, bookprice, bookyear,name,sap)>
<!ELEMENT bookname (#PCDATA)>
<!ELEMENT author1 (#PCDATA)>
<!ELEMENT author2 (#PCDATA)>
<!ELEMENT bookprice (#PCDATA)>
<!ELEMENT bookyear (#PCDATA)>
<!ELEMENT name (#PCDATA)>
<!ELEMENT sap (#PCDATA)>
