<?xml version="1.0" encoding="UTF-8" standalone="no"?>
<!DOCTYPE Books SYSTEM "books.dtd">
<Books>
    <name>Ronit Satish Mehta</name>
    <sap>60009230207</sap>
    <bookname>1984</bookname>
    <author1>George Orwell</author1>
    <author2>Eric Arthur Blair</author2>
    <bookprice>500</bookprice>
    <bookyear>1949</bookyear>
</Books>